{
  "task_queue_id": "post-car-t-relapse-mechanism-gap-public-task-queue-v0",
  "date": "2026-04-14",
  "disease_program": "multiple-myeloma",
  "title": "Post-CAR T Relapse Mechanism Gap Public Task Queue v0",
  "blood_cancer_scope": [
    "multiple myeloma",
    "BCMA-targeted CAR T-cell therapy",
    "post-CAR T relapse",
    "mechanism extraction coverage"
  ],
  "clinical_use_boundary": "research-use-only",
  "gap_register_ids": [
    "bcma-antigen-escape-evidence-gap-register-v0"
  ],
  "source_ids": [
    "pubmed_ledergor_2024_cd4_car_t_exhaustion",
    "pubmed_tedder_bhutani_2025_bcma_resistance",
    "pubmed_yue_2025_bcma_resistance",
    "pubmed_plasma_cell_identity_escape_2025",
    "pubmed_di_meo_2025_sema4a_low_bcma",
    "nci_pdq_myeloma_hp",
    "clinicaltrials_gov",
    "clinicaltrials_gov_api_v2"
  ],
  "tasks": [
    {
      "task_id": "car-t-fitness-second-source-extraction-task-v0",
      "task_title": "Add a second public source extraction for CAR T fitness, exhaustion, expansion, or persistence",
      "task_type": "source-extraction-task",
      "priority": "high",
      "status": "ready",
      "suggested_issue_form": "source-extraction-task.yml",
      "linked_gap_ids": [
        "non-antigen-loss-relapse-buckets-gap-v0"
      ],
      "linked_claim_ids": [
        "bcma-resistance-is-multifactorial-v0"
      ],
      "mechanism_group_ids": [
        "car-t-fitness-exhaustion-persistence-v0"
      ],
      "measurement_term_ids": [
        "relapse-or-disease-progression"
      ],
      "extraction_record_ids": [
        "ledergor-2024-cd4-car-t-exhaustion-v0"
      ],
      "source_ids": [
        "pubmed_tedder_bhutani_2025_bcma_resistance",
        "pubmed_yue_2025_bcma_resistance"
      ],
      "issue_draft_path": "disease-programs/multiple-myeloma/public-tasks/issue-drafts/car-t-fitness-second-source-extraction-task-v0.md",
      "github_issue_url": "https://github.com/SproutSeeds/curing-blood-cancer/issues/15",
      "public_deliverables": [
        "A source-specific mechanism extraction for a public source that maps CAR T fitness, exhaustion, expansion, or persistence signals to the existing mechanism group.",
        "A short note distinguishing review-level mechanism framing from source-specific extraction facts.",
        "An updated coverage report after the extraction record is added."
      ],
      "acceptance_checks": [
        "The new extraction uses the mechanism extraction schema and passes make validate.",
        "The extraction preserves source_id, mechanism_group_id, measurement_term_ids, and clinical_use_boundary.",
        "Review-article statements are not treated as cohort-level measurements unless the underlying source provides them.",
        "Coverage counts are described only as public artifact coverage, not mechanism frequency or biological priority."
      ],
      "what_not_to_infer": [
        "Do not infer that CAR T exhaustion or persistence is the dominant relapse mechanism.",
        "Do not compare CAR T products or recommend treatment sequencing.",
        "Do not convert review-level categories into patient-specific relapse explanations."
      ],
      "safety_boundary": [
        "No patient-specific interpretation.",
        "No diagnostic guidance.",
        "No treatment recommendation.",
        "No trial recommendation.",
        "No cure claim."
      ]
    },
    {
      "task_id": "plasma-cell-identity-first-extraction-task-v0",
      "task_title": "Add the first public extraction for plasma-cell identity or lineage-state escape",
      "task_type": "source-extraction-task",
      "priority": "high",
      "status": "ready",
      "suggested_issue_form": "source-extraction-task.yml",
      "linked_gap_ids": [
        "non-antigen-loss-relapse-buckets-gap-v0"
      ],
      "linked_claim_ids": [
        "bcma-resistance-is-multifactorial-v0",
        "low-bcma-density-supports-alternate-target-research-tracking-v0"
      ],
      "mechanism_group_ids": [
        "plasma-cell-identity-or-lineage-state-escape-v0",
        "bcma-antigen-loss-or-low-density-v0"
      ],
      "measurement_term_ids": [
        "bone-marrow-target-status",
        "antigen-density",
        "relapse-or-disease-progression"
      ],
      "source_ids": [
        "pubmed_plasma_cell_identity_escape_2025",
        "pubmed_di_meo_2025_sema4a_low_bcma",
        "pubmed_yue_2025_bcma_resistance"
      ],
      "issue_draft_path": "disease-programs/multiple-myeloma/public-tasks/issue-drafts/plasma-cell-identity-first-extraction-task-v0.md",
      "github_issue_url": "https://github.com/SproutSeeds/curing-blood-cancer/issues/14",
      "public_deliverables": [
        "A first source-specific extraction for plasma-cell identity, lineage-state escape, or target-linked phenotype change after anti-BCMA therapy.",
        "Explicit handling of peer-review status, model context, sample pairing, and measurement method.",
        "An updated coverage report showing that the bucket has first-extraction coverage."
      ],
      "acceptance_checks": [
        "Preprint or preclinical status is preserved when present in the source record.",
        "Identity-state labels are kept source-specific and are not harmonized across studies without an explicit mapping note.",
        "BCMA-low, BCMA-retained, and alternate-target signals are separated when the source supports separation.",
        "make validate passes after the extraction and coverage update."
      ],
      "what_not_to_infer": [
        "Do not infer clinical efficacy for any alternate target from identity-state evidence alone.",
        "Do not treat a preprint or model-system result as clinical guidance.",
        "Do not claim that lineage-state escape is frequent without denominator-backed evidence."
      ],
      "safety_boundary": [
        "No patient-specific interpretation.",
        "No diagnostic guidance.",
        "No treatment recommendation.",
        "No trial recommendation.",
        "No cure claim."
      ]
    },
    {
      "task_id": "disease-burden-site-risk-context-first-extraction-task-v0",
      "task_title": "Add the first public extraction for disease burden, disease site, and high-risk context",
      "task_type": "source-extraction-task",
      "priority": "medium",
      "status": "ready",
      "suggested_issue_form": "source-extraction-task.yml",
      "linked_gap_ids": [
        "non-antigen-loss-relapse-buckets-gap-v0"
      ],
      "linked_claim_ids": [
        "bcma-resistance-is-multifactorial-v0"
      ],
      "mechanism_group_ids": [
        "disease-burden-site-risk-context-v0"
      ],
      "measurement_term_ids": [
        "progression-free-survival",
        "overall-survival",
        "relapse-or-disease-progression"
      ],
      "source_ids": [
        "nci_pdq_myeloma_hp",
        "clinicaltrials_gov",
        "clinicaltrials_gov_api_v2",
        "pubmed_tedder_bhutani_2025_bcma_resistance"
      ],
      "issue_draft_path": "disease-programs/multiple-myeloma/public-tasks/issue-drafts/disease-burden-site-risk-context-first-extraction-task-v0.md",
      "github_issue_url": "https://github.com/SproutSeeds/curing-blood-cancer/issues/16",
      "public_deliverables": [
        "A first public extraction that captures disease-burden, disease-site, high-risk, prior-therapy, and eligibility-context fields for relapse-mechanism interpretation.",
        "A field note separating context variables from direct biological relapse mechanisms.",
        "An updated coverage report showing first-extraction coverage for the disease-burden/site/risk bucket."
      ],
      "acceptance_checks": [
        "Context fields are not treated as causal mechanisms unless the source explicitly supports that interpretation.",
        "Trial-registry fields are labeled as registry context, not proof of efficacy, availability, eligibility, or safety.",
        "Cytogenetic, extramedullary, prior-line, and prior-BCMA exposure fields preserve the source's definitions.",
        "make validate passes after the extraction and coverage update."
      ],
      "what_not_to_infer": [
        "Do not infer patient-specific risk from public registry or overview fields.",
        "Do not recommend a trial or treatment based on eligibility or baseline-characteristic fields.",
        "Do not rank relapse mechanisms until context extraction is more complete."
      ],
      "safety_boundary": [
        "No patient-specific interpretation.",
        "No diagnostic guidance.",
        "No treatment recommendation.",
        "No trial recommendation.",
        "No cure claim."
      ]
    }
  ],
  "review": {
    "created": "2026-04-14",
    "last_reviewed": "2026-04-14",
    "review_status": "source-checked",
    "review_notes": [
      "Derived from under-covered buckets in post-car-t-relapse-mechanism-coverage-v0.",
      "Tasks are contribution-ready extraction tasks, not evidence-strength rankings.",
      "Each task is scoped to public sources and public artifact updates only."
    ]
  }
}
